{
  "schema_version": 1,
  "id": "owner/recovery-retrospective",
  "title": "能力误上传恢复经验模板",
  "kind": "lesson",
  "summary": "内置示例：能力误上传恢复经验模板。未验证真实策划业务，供试用与改编。",
  "tags": [
    "内置示例",
    "lesson"
  ],
  "aliases": [
    "误上传复盘"
  ],
  "author_key": "owner",
  "owner_key": "owner",
  "source": {
    "type": "original",
    "reference": "本次平台实现生成的内置示例；非既有团队实绩或真实业务资料。"
  }
}
