{
  "schema_version": 1,
  "id": "owner/meeting-summary",
  "title": "会议记录整理提示词",
  "kind": "prompt",
  "summary": "内置示例：会议记录整理提示词。未验证真实策划业务，供试用与改编。",
  "tags": [
    "内置示例",
    "prompt"
  ],
  "aliases": [
    "整理会议"
  ],
  "author_key": "owner",
  "owner_key": "owner",
  "source": {
    "type": "original",
    "reference": "本次平台实现生成的内置示例；非既有团队实绩或真实业务资料。"
  }
}
