{
  "schema_version": 1,
  "id": "owner/experience-case",
  "title": "可复用经验沉淀模板",
  "kind": "case",
  "summary": "内置示例：可复用经验沉淀模板。未验证真实策划业务，供试用与改编。",
  "tags": [
    "内置示例",
    "case"
  ],
  "aliases": [
    "整理经验"
  ],
  "author_key": "owner",
  "owner_key": "owner",
  "source": {
    "type": "original",
    "reference": "本次平台实现生成的内置示例；非既有团队实绩或真实业务资料。"
  }
}
