{
  "schema_version": 1,
  "id": "owner/review-checklist",
  "title": "AI 工作成果检查清单",
  "kind": "skill",
  "summary": "内置示例：AI 工作成果检查清单。未验证真实策划业务，供试用与改编。",
  "tags": [
    "内置示例",
    "skill"
  ],
  "aliases": [
    "查漏项"
  ],
  "author_key": "owner",
  "owner_key": "owner",
  "source": {
    "type": "original",
    "reference": "本次平台实现生成的内置示例；非既有团队实绩或真实业务资料。"
  }
}
